{
  "$schema": "./neapolitan_model_schema.json",
  "model_type": "ssdc_circuit",
  "nodes": 4,
  "configuration": {
    "0": {
      "potential": [
        0.0
      ],
      "is_locked": true,
      "metadata": null
    }
  },
  "elements": [
    {
      "element_type": "voltage_source",
      "input": 0,
      "output": 1,
      "gain": [
        3.0
      ]
    },
    {
      "element_type": "resistor",
      "input": 1,
      "output": 2,
      "gain": [
        2.0
      ]
    },
    {
      "element_type": "resistor",
      "input": 1,
      "output": 2,
      "gain": [
        2.0
      ]
    },
    {
      "element_type": "resistor",
      "input": 2,
      "output": 3,
      "gain": [
        1.0
      ]
    },
    {
      "element_type": "resistor",
      "input": 3,
      "output": 0,
      "gain": [
        1.0
      ]
    }
  ]
}